ubuntu@ip-10-10-10-254:~$ sudo tcpdump -i ens6 -c 5 icmp
tcpdump: verbose output suppressed, use -v[v]... for full protocol decode
listening on ens6, link-type EN10MB (Ethernet), snapshot length 262144 bytes
13:37:19.557427 IP 10.10.20.10 > 10.10.20.254: ICMP echo request, id 1, seq 1, length 64
13:37:20.603051 IP 10.10.20.10 > 10.10.20.254: ICMP echo request, id 1, seq 2, length 64
13:37:21.627054 IP 10.10.20.10 > 10.10.20.254: ICMP echo request, id 1, seq 3, length 64
13:37:22.651066 IP 10.10.20.10 > 10.10.20.254: ICMP echo request, id 1, seq 4, length 64
13:37:23.675064 IP 10.10.20.10 > 10.10.20.254: ICMP echo request, id 1, seq 5, length 64
5 packets captured
5 packets received by filter
0 packets dropped by kernel